[
  {
    "id": "smartkargo-2026-10-26-first-ai-apps-released-for-airline-cargo-risk-revenue-and-cost",
    "company": "SmartKargo",
    "parent_group": "",
    "sector": "Transport",
    "industry": "Logistics & Delivery",
    "entity_type": "Tech vendor",
    "fortune500_rank": null,
    "country": "United States",
    "region": "North America",
    "business_area": "Supply Chain",
    "record_type": "Product launch",
    "ai_type": "Predictive ML",
    "title": "First AI apps released for airline cargo risk, revenue and cost",
    "description": "SmartKargo, a US cloud logistics platform for airline cargo, released its first four AI applications for airline cargo risk, revenue and cost. Air cargo is an unusually good fit for this kind of forecasting because capacity is perishable and priced dynamically, but no customer or result has yet been attached.",
    "vendor": "",
    "outcome": "Not disclosed. This is a first release with no named airline customers and no performance figures.",
    "metric": "",
    "investment_amount": "",
    "status": "Announced",
    "digest_line": "SmartKargo released its first four AI apps for airline cargo, aimed at cutting risk and cost and capturing revenue",
    "title_ru": "Выпущены первые AI-приложения для рисков, выручки и затрат в авиагрузах",
    "description_ru": "SmartKargo — американская облачная логистическая платформа для авиагрузов, выпустила первые четыре AI-приложения для рисков, выручки и затрат в авиагрузах. Авиагрузы хорошо подходят под такое прогнозирование, поскольку провозная ёмкость скоропортящаяся и цена динамическая, но ни клиентов, ни результатов пока не названо.",
    "outcome_ru": "Не раскрыто. Это первый релиз без названных авиакомпаний-клиентов и без показателей работы.",
    "digest_line_ru": "SmartKargo выпустила первые четыре AI-приложения для авиагрузов, нацеленные на снижение рисков и затрат и рост выручки",
    "event_date": "2026-10-26",
    "source_name": "GlobeNewswire",
    "source_url": "https://www.globenewswire.com/news-release/2026/10/26/3388100/0/en/smartkargo-launches-ai-apps-portfolio-to-help-airlines-reduce-risk-drive-revenue-and-cut-cost.html",
    "source_tier": "primary",
    "source_channel": "press release",
    "confidence": "med",
    "added_at": "2026-10-26T16:10:00+00:00"
  },
  {
    "id": "mediclinic-middle-east-2026-10-26-ambient-ai-note-taking-extended-after-a-trial-with-more-",
    "company": "Mediclinic Middle East",
    "parent_group": "",
    "sector": "Health",
    "industry": "Healthcare Providers",
    "entity_type": "Large enterprise",
    "fortune500_rank": null,
    "country": "United Arab Emirates",
    "region": "MENA",
    "business_area": "Product",
    "record_type": "Partnership",
    "ai_type": "NLP",
    "title": "Ambient AI note-taking extended after a trial with more than 60 Dubai doctors",
    "description": "Mediclinic Middle East, the UAE hospital arm of the international group Mediclinic, extended ambient AI clinical note-taking with Commure after a project involving more than 60 doctors at two Dubai hospitals. Working with Commure, it is extending ambient AI that listens to clinician-patient conversations and converts them into structured clinical notes for the doctor to review. The extension follows a project involving more than 60 doctors at two Dubai hospitals, so this is a scale-up from a sizeable trial rather than a first deployment.",
    "vendor": "Commure",
    "outcome": "Not disclosed. More than 60 doctors took part in the preceding project at two Dubai hospitals, but no time-saved, accuracy or satisfaction figure was published.",
    "metric": "60+ doctors in the preceding project",
    "investment_amount": "",
    "status": "Scaling",
    "digest_line": "Mediclinic Middle East extended ambient AI clinical note-taking with Commure after a project involving more than 60 doctors at two Dubai hospitals",
    "title_ru": "Ambient AI для медицинских записей расширяется после пилота с более чем 60 врачами в Дубае",
    "description_ru": "Mediclinic Middle East — подразделение международной сети Mediclinic в ОАЭ, расширила ambient AI для клинических записей вместе с Commure после проекта с участием более 60 врачей в двух больницах Дубая. Совместно с Commure компания расширяет применение ambient AI, который слушает разговор врача с пациентом и превращает его в структурированные клинические записи для проверки врачом. Расширение следует за проектом с участием более 60 врачей в двух больницах Дубая, то есть это масштабирование после крупного пилота, а не первое внедрение.",
    "outcome_ru": "Не раскрыто. В предшествующем проекте участвовали более 60 врачей в двух больницах Дубая, но показателей экономии времени, точности или удовлетворённости не публиковалось.",
    "digest_line_ru": "Mediclinic Middle East расширила ambient AI для клинических записей вместе с Commure после проекта с участием более 60 врачей в двух больницах Дубая",
    "event_date": "2026-10-26",
    "source_name": "Healthcare Middle East",
    "source_url": "https://www.healthcaremea.com/2026/10/26/mediclinic-middle-east-partners-with-commure-to-advance-ambient-ai-in-uae-clinical-care/",
    "source_tier": "news",
    "source_channel": "trade press",
    "confidence": "med",
    "added_at": "2026-10-26T16:10:00+00:00"
  },
  {
    "id": "barclays-2026-10-26-group-chief-of-staff-appointed-as-the-bank-s-first-chief-ai-officer",
    "company": "Barclays",
    "parent_group": "",
    "sector": "Financial",
    "industry": "Banks",
    "entity_type": "Large enterprise",
    "fortune500_rank": null,
    "country": "United Kingdom",
    "region": "UK & Ireland",
    "business_area": "HR",
    "record_type": "Org / leadership",
    "ai_type": "Other",
    "title": "Group chief of staff appointed as the bank's first chief AI officer",
    "description": "Barclays, one of the UK's largest banks, appointed its group chief of staff Anita Tanna as its first chief AI officer. Promoting the chief of staff rather than hiring a technologist says the role is being framed as coordination across the bank rather than as a technical function. It follows the bank's expanded Claude Code rollout earlier in the month, and no remit, budget or reporting line was published with the appointment.",
    "vendor": "",
    "outcome": "Not disclosed. No remit, budget, team size or reporting line was published with the appointment.",
    "metric": "",
    "investment_amount": "",
    "status": "Announced",
    "digest_line": "Barclays appointed group chief of staff Anita Tanna as its first chief AI officer, framing the role as coordination rather than technology",
    "title_ru": "Руководитель аппарата группы назначена первым директором банка по AI",
    "description_ru": "Barclays — один из крупнейших банков Великобритании, назначил руководителя аппарата группы Аниту Танну первым директором по AI. Повышение руководителя аппарата, а не найм технолога, говорит о том, что роль понимается как координация по всему банку, а не как техническая функция. Назначение следует за расширением Claude Code ранее в том же месяце; полномочия, бюджет и подчинённость не публиковались.",
    "outcome_ru": "Не раскрыто. Полномочия, бюджет, размер команды и подчинённость при назначении не публиковались.",
    "digest_line_ru": "Barclays назначил руководителя аппарата Аниту Танну первым директором по AI, определив роль как координацию, а не технологию",
    "event_date": "2026-10-26",
    "source_name": "FinTech Futures",
    "source_url": "https://fintechfutures.com/job-cuts-new-hires/anita-tanna-appointed-as-first-chief-ai-officer-at-barclays",
    "source_tier": "news",
    "source_channel": "trade press",
    "confidence": "med",
    "added_at": "2026-10-26T18:00:00+00:00"
  },
  {
    "id": "infosys-2026-10-23-ai-work-reaches-10-5-of-revenue-growing-29-in-a-quarter",
    "company": "Infosys",
    "parent_group": "",
    "sector": "Technology",
    "industry": "IT Services & Consulting",
    "entity_type": "Large enterprise",
    "fortune500_rank": null,
    "country": "India",
    "region": "Asia-Pacific",
    "business_area": "Finance",
    "record_type": "Use case",
    "ai_type": "Generative AI",
    "title": "AI work reaches 10.5% of revenue, growing 29% in a quarter",
    "description": "Infosys, one of India's largest IT services firms, reported that AI work now accounts for 10.5% of its revenue and grew 29% quarter on quarter, on total quarterly revenue of about $5.1bn. This is one of the few disclosures that states AI as a share of revenue rather than as a productivity claim, which makes it a harder number than most in this tracker. The same results cut full-year growth guidance to 1-2% from 1.5-3%, so the AI line is growing inside a business that is not.",
    "vendor": "",
    "outcome": "AI work at 10.5% of total revenue, up 29% quarter on quarter, on about $5.1bn quarterly revenue. Full-year growth guidance was cut to 1-2% from 1.5-3% in the same results.",
    "metric": "10.5% of revenue, +29% QoQ",
    "investment_amount": "",
    "status": "Scaling",
    "digest_line": "Infosys said AI work now makes up 10.5% of revenue and grew 29% in a quarter, while cutting full-year growth guidance to 1-2%",
    "title_ru": "AI-направление достигло 10,5% выручки с ростом 29% за квартал",
    "description_ru": "Infosys — одна из крупнейших ИТ-сервисных компаний Индии, сообщила, что работы с AI составляют 10,5% выручки и выросли на 29% за квартал при общей квартальной выручке около $5,1 млрд. Это одно из немногих раскрытий, где AI указан как доля выручки, а не как заявление о продуктивности, и такой показатель жёстче большинства в этом трекере. В тех же результатах прогноз годового роста снижен до 1-2% с 1,5-3%, то есть AI-направление растёт внутри бизнеса, который не растёт.",
    "outcome_ru": "AI-направление — 10,5% общей выручки, рост на 29% за квартал при квартальной выручке около $5,1 млрд. В тех же результатах прогноз годового роста снижен до 1-2% с 1,5-3%.",